consulta,dia_semana,semana_del_mes,mes,cuatrimestre,anio,hora_discretizada,dni_discretizado,legajo_discretizado,posee_legajo,posee_telefono,carrera_valor,proveedor_correo,cantidad_caracteres,proporcion_mayusculas,proporcion_letras,cantidad_tildes,cantidad_palabras,cantidad_palabras_cortas,proporcion_palabras_distintas,frecuencia_signos_puntuacion,cantidad_oraciones,utiliza_codigo_asignatura,score,clase
"hola! me anoté para rendir un final, pero me di cuenta que no estaban cargadas las actas y figura como libre aún, siendo que regularice la materia, me anoté al final como libre, como hago para cambiarlo a regular? gracias! ",2,1,12,2,2018,1,6,3,1,1,54,3,223,0.0,0.7892376681614349,3,41,22,0.8292682926829268,0.03139013452914798,1,0,22.125805,Exámenes
buenos días! quería consultar si hay manera de cambiar mi solicitud de inscripción a finales de la materia derecho ii ya que él sistema me inscribió como libre y debe rendir de forma regular. debo acercarme a la universidad a cambiarlo o cuando ribda aclaro que me inscribí mal?  ,4,5,6,1,2018,0,8,4,1,1,3,12,280,0.0,0.8107142857142857,6,51,27,0.8235294117647058,0.010714285714285714,1,0,21.984179,Exámenes
"buenas tardes, quería saber si había algún inconveniente con la página para realizar la inscripción a los exámenes finales, ya que estoy tratando de inscribirme para rendir examen final de elementos y me dice que no se encuentra habilitada la inscripción, ya me encuentro regular en la materia, así figura también en mi situación académica, pero no logro anotarme, agradezco su ayuda, muchas gracias ",1,1,7,1,2019,1,2,1,1,1,3,7,400,0.0,0.8225,11,65,30,0.8461538461538461,0.0175,1,0,21.960466,Exámenes
"me inscribí a un examen final como libre pero mi situación es regular, quería saber si es posible cambiar la situación a regular ",0,2,12,2,2015,1,6,3,1,1,54,3,129,0.0,0.813953488372093,4,24,12,0.875,0.007751937984496124,1,0,21.934683,Exámenes
"hola quería consultar: -&iquest;cuántas materias y en qué lapso de tiempo, se debe rendir como mínimo para no quedar libre en la carrera?  -y una vez regular &iquest;cuánto es el lapso de tiempo máximo para poder presentarse a rendir un final?  espero su respuesta, saludos. ",3,4,7,1,2016,3,3,0,0,1,25,7,275,0.0,0.7854545454545454,6,48,25,0.8541666666666666,0.02909090909090909,1,0,21.839067,Exámenes
"quisiera saber cuantas oportunidades de rendir final tengo por materia, hasta perder la regularidad de esta.. gracias. ",0,2,9,2,2016,2,6,3,1,0,19,7,119,0.0,0.8235294117647058,0,18,5,0.9444444444444444,0.03361344537815126,3,0,21.837765,Exámenes
"quisiera saber cuantas oportunidades de rendir final tengo por materia, hasta perder la regularidad de esta.. gracias. ",0,2,9,2,2016,2,6,3,1,0,19,7,119,0.0,0.8235294117647058,0,18,5,0.9444444444444444,0.03361344537815126,3,0,21.837765,Exámenes
cuando debería empezar a cursar las materias? quede regular en los dos examenes ,2,1,3,1,2017,3,7,4,1,1,54,3,80,0.0,0.825,1,14,6,1.0,0.0125,1,0,21.736174,Exámenes
"hola, queria averiguar como hago para saber dos notas que no figuran. analisis socioeconomico, rendi el final y me quedo un 7. taller de lectura rendi el final el lunes 18/12 y nose la nota.  gracias!!! ",4,4,12,2,2017,0,3,4,1,1,29,14,203,0.0,0.7487684729064039,0,38,19,0.8421052631578947,0.03940886699507389,3,0,21.71642,Exámenes
"hola, yo me inscribí para el examen de psicología del desarrollo en modo libre, siendo que quede para regular, como puedo cambiar la situación?.  ",2,4,6,1,2018,1,8,4,1,0,43,3,146,0.0,0.7945205479452054,3,26,14,0.9230769230769231,0.03424657534246575,1,0,21.642162,Exámenes
"hola, tengo en condicion de regular sin rendir el final  una materia ,me anotare a un seminario que es correlativo.. de esta materia...estare en condicion de promocionarlo aun sin haber rendido todavia el final? lei el art 20 del estatuto pero me quedo la duda igual.gracias. ",0,3,2,1,2017,0,1,3,1,1,29,3,276,0.0,0.7862318840579711,0,48,28,0.8333333333333334,0.036231884057971016,7,0,21.633638,Exámenes
"hola, yo necesitaba hacer una consulta sobre las mesas de finales. tengo que rendir el final de la asignatura fisicoquimica del medio natural, me aparecen tres fechas en la sede de lujan de los dias 12, 19 y 26. mi duda es, al ser tres mesas yo me puedo anotar en la primer mesa del dia 12 y si me va mal en esa anotarme en la ultima del dia 26? dado que esta mesa de febrero es mi ultima oportunidad para rendir en condicion de regular ya que se me vence el plazo ahora. muchas gracias, saludos! ",4,2,1,1,2019,1,5,2,1,0,29,3,497,0.0,0.7625754527162978,0,99,64,0.7070707070707071,0.02012072434607646,3,0,21.601797,Exámenes
hola!como hago si quiero saber una nota de un examen final?gracias! ,2,3,2,1,2017,1,4,1,1,1,3,3,68,0.0,0.7941176470588235,0,12,7,1.0,0.04411764705882353,1,0,21.509119000000002,Exámenes
hola buenas tardes tengo una consulta respecto ala regularidad de materias si tengo una materia en condicion regular. cuanto tiempo tengo para darla es decir de cuanto es el plazo en el que la materia queda en estado regular? gracias. ,1,2,12,2,2018,1,6,3,1,0,3,7,235,0.0,0.8170212765957446,0,41,18,0.7560975609756098,0.01276595744680851,2,0,21.470589999999998,Exámenes
"hola, yo me inscribí para dar examen final la primer semana de fechas de exámenes (esta semana),  como no las di como hago para inscribirme para los siguientes exámenes? ",3,2,7,1,2019,2,8,4,1,0,17,3,170,0.0,0.7941176470588235,3,31,18,0.8387096774193549,0.01764705882352941,1,0,21.463955,Exámenes
hola yo me inscribi pero no rendi los examenes... puedo anotarme a las materias nuevamente o tengo que rendir de nuevo la materia de ingreso ya que es correlativa con las de la carrera ,3,5,1,1,2019,1,3,4,1,1,54,7,185,0.0,0.8,0,35,21,0.8571428571428571,0.016216216216216217,3,0,21.402416,Exámenes
"buenas tardes, yo di final en el dia de la fecha de hoy de la materia analisis socioeconomico como regular, pero como no habian cargado mi acta tuve que anotarme como libre via campus digital, asi mismo lo comente con los profesores de la mesa de examen y lo dejaron por escrito, mi duda es donde puedo fijarme la nota del mismo. saludos, paula. ",2,1,7,1,2016,2,5,3,1,1,29,3,346,0.0,0.7947976878612717,0,65,39,0.8307692307692308,0.02023121387283237,2,0,21.159403,Exámenes
"hola, quisiera saber cuanto tiempo me dura la prorroga de regularidad que pedí, es para poder dar el examen final como regular.  gracias  ",0,3,9,2,2019,1,4,2,1,0,2,3,138,0.0,0.7971014492753623,1,26,13,0.9230769230769231,0.021739130434782608,1,0,21.025473,Exámenes
"buenas, la consulta es la siguiente: acabo de desaprobar el taller de análisis y resolución de problemas, quedé en condición de libre, el cuatrimestre pasado aprobé 3 materias, dos promocioné y una me quedó regular y desaprobe el final, con el taller desaprobado como queda? me guardan las notas o pierdo todo lo que di?  ",4,1,8,2,2018,3,4,4,1,1,54,7,322,0.0,0.7981366459627329,7,57,30,0.7894736842105263,0.024844720496894408,1,0,21.007488000000002,Exámenes
"buen dia - necesitaría saber al quedar regular en una materia cursada, pierdo esa regularidad en algún momento ? cuanto tiempo tengo para rendir el final ?? gracias por su pronta respuesta, dado que tengo que definir presentaciones en 07-08/2017 - saludos .-  ",6,2,7,1,2017,1,1,1,1,1,3,7,260,0.0,0.7576923076923077,2,45,22,0.8666666666666667,0.023076923076923078,1,0,20.966484,Exámenes
"hola, en agosto me había anotado para rendir el final de introducción a la administración en condición de regular y me saque un 4 en el final y quede regular. &iquest;tengo que volver a anotarme para rendir el final de esa materia? ",1,4,11,2,2016,0,7,0,0,0,54,7,232,0.0,0.7931034482758621,4,43,23,0.6976744186046512,0.017241379310344827,1,0,20.905874,Exámenes
"buen día, continuo con la duda en cuanto al final rendido el 26/9 de estado y políticas sociales 1. aprobé la materia con (6), y quedo en condición regular? aun no pasaron la nota,... gracias y disculpa mi inseguridad. saludos ",5,4,9,2,2019,0,1,1,1,1,5,14,227,0.0,0.748898678414097,4,41,23,0.8536585365853658,0.039647577092511016,5,0,20.854983999999998,Exámenes
quería saber si puedo rendir examen final en condición de libre en febrero? es obligatorio rendir en diciembre?  ,2,2,12,2,2017,2,7,4,1,1,3,3,113,0.0,0.8141592920353983,2,20,8,0.8,0.017699115044247787,1,0,20.741135,Exámenes
"hola si ayer  verifique si me aceptaron la inscribcion a cursada  a administración integrativa y resulta que no me la aceptaron porque tengo que dar un examen final el 8 de marzo. y me contestaron hoy que cuando este el resultado cargado que espero aprobar por las dudas, ahí me puedo inscribir. mi pregunta es cuando me puedo inscribir tengo un periodo de inscripción fuera de termino u ya queda que me inscribí provisoria mente en la lista? ",1,4,2,1,2018,1,2,1,1,0,3,12,443,0.0,0.8081264108352144,4,81,45,0.7037037037037037,0.009029345372460496,2,0,20.64068,Exámenes
"hola disculpen otra consulta ,cuantas oportunidades de dar un final son ? se cuentan las ausencias tambien? antes de perder la regularidad.gracias ",1,4,11,2,2016,0,1,3,1,1,29,3,147,0.0,0.8231292517006803,0,23,12,0.9565217391304348,0.027210884353741496,1,0,20.524921,Exámenes
buenas tardes quisiera saber cuando cargan las notas de examen del día 12/2 ya que necesito aparezca en sistema y poder anotarme para rendir una materia correlativa en el último llamado . muchas gracias ,1,3,2,1,2016,2,2,2,1,0,43,7,203,0.0,0.8078817733990148,2,35,15,0.9714285714285714,0.0049261083743842365,1,0,20.52222,Exámenes
"buenas tardes, mi consulta es sobre la nota de un final que rendi el dia 16-05 el cual me figura que me saque un 2, cuando ese luego de rendir el examen me llamaron y me dijeron que me habia sacado un 5. quisiera saber donde puedo verificar esto, o que hacer. ya que tengo que anotarme en una correlativa para poder rendir final ",4,1,7,1,2019,1,7,4,1,1,54,3,329,0.0,0.7689969604863222,0,65,35,0.7538461538461538,0.015197568389057751,2,0,20.457922,Exámenes
"hola, quiero hacer una pregunta sobre el examen final de elementos de matematica i ya di el examen final mas de una vez intentando aprobar, &iquest;hasta cuando puedo seguir dando el examen? ",2,4,9,2,2015,3,5,2,1,0,54,10,191,0.0,0.806282722513089,0,33,14,0.7878787878787878,0.020942408376963352,1,0,20.452467000000002,Exámenes
hola. ya ha pasado una semana del que di el examen final de matematica 2 y todavía no se la nota y me tengo que anotar a las materias. como hago para saber el esultado del examen.? gracias.  ,1,1,8,2,2018,3,5,2,1,0,54,10,191,0.0,0.7643979057591623,1,40,26,0.875,0.02617801047120419,4,0,20.435278,Exámenes
hola.  necesito ingresar al perfil aspirante y al poner el dni aparece: no existen datos para el aspirante ingresado. ya realice la pre-inscripción online.  gracias ,2,1,3,1,2017,2,7,0,0,1,17,3,165,0.0,0.806060606060606,1,28,13,0.8214285714285714,0.024242424242424242,3,0,38.42161,Ingreso a la Universidad
hola. no me deja ingresar a &quot;acceso para aspirantes&quot;. introduzco mi dni y sale un mensaje &quot;no existen datos para el aspirante ingresado&quot;. ya hice la preinscripcion online y la inscripcion en la univercidad. gracias ,3,4,5,1,2019,1,8,0,0,1,17,3,235,0.0,0.8,0,36,20,0.8888888888888888,0.03404255319148936,4,0,35.769928,Ingreso a la Universidad
buenos dias acabo de realizar la inscripcion web y no llega a mi mail el formulario para continuar con el proceso de inscripción ,2,2,2,1,2018,1,6,0,0,0,19,7,129,0.0,0.8217054263565892,1,24,15,0.9166666666666666,0.0,1,0,29.362379999999998,Ingreso a la Universidad
buenos dias acabo de realizar la inscripcion web y no llega a mi mail el formulario para continuar con el proceso de inscripción ,2,2,2,1,2018,1,6,0,0,0,19,7,129,0.0,0.8217054263565892,1,24,15,0.9166666666666666,0.0,1,0,29.362379999999998,Ingreso a la Universidad
buenos dias acabo de realizar la inscripcion web y no llega a mi mail el formulario para continuar con el proceso de inscripción ,2,2,2,1,2018,1,6,0,0,0,19,7,129,0.0,0.8217054263565892,1,24,15,0.9166666666666666,0.0,1,0,29.362379999999998,Ingreso a la Universidad
buenos dias acabo de realizar la inscripcion web y no llega a mi mail el formulario para continuar con el proceso de inscripción ,2,2,2,1,2018,1,6,0,0,0,19,7,129,0.0,0.8217054263565892,1,24,15,0.9166666666666666,0.0,1,0,29.362379999999998,Ingreso a la Universidad
hola! yo ya complete la pre-inscripción y cuando quiero ingresar con el numero de documento al usuario de aspirantes me indica que no existen datos. ,3,3,10,2,2018,0,5,0,0,1,43,7,149,0.0,0.8120805369127517,1,26,13,0.9615384615384616,0.013422818791946308,1,0,29.304031,Ingreso a la Universidad
"hola,ya ingrese como aspirante y seguí los pasos para la inscripción a cursadas pero luego no me llega el mail que dice que me mandan  ",2,1,2,1,2018,1,8,0,0,1,25,7,135,0.0,0.8,2,27,17,0.8888888888888888,0.007407407407407408,1,0,29.167484,Ingreso a la Universidad
necesito ingresar la inscripcion web y no me llega el enlace al mail para continuar los pasos ,2,1,3,1,2017,1,3,0,0,1,52,3,94,0.0,0.8191489361702128,0,18,11,1.0,0.0,1,0,29.012928000000002,Ingreso a la Universidad
"buenos días! mi pregunta es acerca de la inscripción para aspirantes, yo lleno el primer formulario vía web pero nunca me llega el correo para continuar la inscripción. quería consultar en ese caso que podría hacer.  ",0,4,2,1,2018,0,8,0,0,0,0,7,217,0.0,0.8110599078341014,6,38,20,0.8947368421052632,0.018433179723502304,2,0,28.790833000000003,Ingreso a la Universidad
"buenos días! mi pregunta es acerca de la inscripción para aspirantes, yo lleno el primer formulario vía web pero nunca me llega el correo para continuar la inscripción. quería consultar en ese caso que podría hacer.  ",0,4,2,1,2018,0,8,0,0,0,0,7,217,0.0,0.8110599078341014,6,38,20,0.8947368421052632,0.018433179723502304,2,0,28.790833000000003,Ingreso a la Universidad
"buenos días! mi pregunta es acerca de la inscripción para aspirantes, yo lleno el primer formulario vía web pero nunca me llega el correo para continuar la inscripción. quería consultar en ese caso que podría hacer.  ",0,4,2,1,2018,0,8,0,0,0,0,7,217,0.0,0.8110599078341014,6,38,20,0.8947368421052632,0.018433179723502304,2,0,28.790833000000003,Ingreso a la Universidad
"buenos días! mi pregunta es acerca de la inscripción para aspirantes, yo lleno el primer formulario vía web pero nunca me llega el correo para continuar la inscripción. quería consultar en ese caso que podría hacer.  ",0,4,2,1,2018,0,8,0,0,0,0,7,217,0.0,0.8110599078341014,6,38,20,0.8947368421052632,0.018433179723502304,2,0,28.790833000000003,Ingreso a la Universidad
"hola, tengo un problema al querer ingresar al perfil aspirantes. ingreso mi numero de documento pero me dice que no existen datos para el aspirante ingresado...  ",6,3,12,2,2018,3,7,0,0,1,54,10,162,0.0,0.8024691358024691,0,28,14,0.9285714285714286,0.030864197530864196,4,0,28.407734,Ingreso a la Universidad
"buenas tardes, ya realice la solicitud de preinscricion por internet pero aun no me llego ningún mensaje a mi casilla de correo electrónico para poder continuar con la inscripción. &iquest;que debo hacer? ",2,1,5,1,2017,1,3,0,0,1,0,7,205,0.0,0.8195121951219512,3,33,16,0.9393939393939394,0.01951219512195122,1,0,28.25262,Ingreso a la Universidad
"hola buenas tardes, no me llega el mail para poder seguir con la pre inscripcion y asi llegar a la incripcion correspondiente para la carrera de contador publico quisiera saber porq no me llega muchas gracias brian ",3,3,2,1,2018,2,7,0,0,0,0,3,215,0.0,0.8232558139534883,0,38,20,0.8421052631578947,0.004651162790697674,1,0,27.976653999999996,Ingreso a la Universidad
"buenas tardes, hice el paso 1 de 3 de la pre inscripcion online pero no me llega el mail de confirmacion. gracias  ",0,4,4,1,2018,2,4,0,0,1,3,3,115,0.0,0.7652173913043478,0,24,17,0.8333333333333334,0.017391304347826087,1,0,27.790602000000003,Ingreso a la Universidad
"buenas tardes, hice el paso 1 de 3 de la pre inscripcion online pero no me llega el mail de confirmacion. gracias  ",0,4,4,1,2018,2,4,0,0,1,3,3,115,0.0,0.7652173913043478,0,24,17,0.8333333333333334,0.017391304347826087,1,0,27.790602000000003,Ingreso a la Universidad
no me llega el mail para continuar la preinscripcion.  gracias ,2,1,2,1,2019,3,2,0,0,0,7,3,63,0.0,0.8095238095238095,0,12,8,0.9166666666666666,0.015873015873015872,1,0,27.52453,Ingreso a la Universidad
"buenas tardes, estoy tratando de realizar la preinscripción vía web pero no me llega la confirmación a mi correo para pasar al segundo paso. correo electrónico correcto: ludmiijerez16@gmail.com ",3,3,2,1,2018,1,8,0,0,0,0,3,194,0.0,0.8195876288659794,4,29,13,0.9310344827586207,0.020618556701030927,2,0,27.501621000000004,Ingreso a la Universidad
"&iquest;es normal que al ingresar al &quot;acceso e aspirantes&quot; en el día de la fecha, luego de ingresar el dni me diga &quot;no existen datos para el aspirante ingresado.&quot;?     ",3,3,11,2,2015,1,8,0,0,1,54,3,188,0.0,0.7553191489361702,1,34,21,0.7352941176470589,0.0425531914893617,1,0,27.137829999999997,Ingreso a la Universidad
no me llega el e-mail para continuar con mis inscripción no está en correo no deseado tampoco! ,0,4,10,2,2016,3,7,0,0,1,43,12,95,0.0,0.8,2,18,11,0.8888888888888888,0.010526315789473684,1,0,27.042152,Ingreso a la Universidad
no puedo realizar la inscripción a cursadas. debido a que no llega el e mail a mi correo electrónico ,1,3,2,1,2019,0,7,0,0,0,52,3,101,0.0,0.801980198019802,2,20,12,0.85,0.009900990099009901,1,0,26.920679999999997,Ingreso a la Universidad
no me llega el correo para la pre inscripcion. como hago? ,0,3,11,2,2016,2,3,0,0,1,43,7,58,0.0,0.7758620689655172,0,12,8,1.0,0.034482758620689655,1,0,26.90284,Ingreso a la Universidad
"hola bueno hace un mes me pre-inscribi por la web y despues en la sede de lujan una vez completado los datos me dijeron que ingrese hoy 16 de diciembre a la web al area de aspirantes para confirmar que voy a ir y me pide el dni e ingreso el dni y me aparece en la pantalla no existen datos para el aspirante ingresado , qeria saber como puedo hacer  ",2,3,12,2,2015,1,7,0,0,1,2,3,350,0.0,0.7828571428571428,0,73,51,0.726027397260274,0.002857142857142857,1,0,26.66749,Ingreso a la Universidad
"hola buenas tardes , desde la dirección de la universidad  me dijeron que ingresara a:   https://saweb.unlu.edu.ar/academica/aspirante-index.php   para obtener información de mi aula &amp; demás, pero al poner mi numero de documento 40.377.098 me dice que no existen datos para el aspirante ingresado  pues ya hice la pre-inscripción vía web poniendo todos mis datos , en la dirección misma también .  ",3,4,11,2,2018,2,6,0,0,1,3,12,402,0.0,0.763681592039801,7,68,41,0.7205882352941176,0.03233830845771144,7,0,26.636274,Ingreso a la Universidad
"hola, me llego el siguiente mensaje a mi correo &quot;ud. tiene una notificación de la dirección general de asuntos académicos.por favor ingrese a servicios académicos web y notifíquese&quot; no puedo ingresar al perfil de aspirante con mi dni, dice que no existen datos para el aspirante ingresado. me falta algún tipo de tramite para poder cursar en 2018?, saludos! ",6,1,12,2,2017,3,2,0,0,1,54,7,368,0.0,0.7961956521739131,6,60,28,0.8333333333333334,0.02717391304347826,3,0,26.350098,Ingreso a la Universidad
no me llega el correo electrónico para poder seguir con la inscripción ,3,3,2,1,2019,1,8,0,0,1,54,3,71,0.0,0.8309859154929577,2,13,7,1.0,0.0,1,0,26.181759,Ingreso a la Universidad
hola. quería saber después de empezar el trámite de pre inscripción cuanto tardan en enviar el mail para continuar. ya que han pasado varias horas y aún no me llegó. gracias  ,3,3,10,2,2019,3,3,0,0,1,0,7,175,0.0,0.8,6,33,17,0.9090909090909091,0.017142857142857144,3,0,26.146342999999998,Ingreso a la Universidad
"buenas noches, desconozco mi legajo y cuando intento ingresar al perfil aspirante al colocar el dni me dice que no existen datos para el aspirante ingresado. los papeles de inscripcion para cursar el primer cuatrimestre del 2020 los presente el dia 31/10/2019. espero su respuesta. saludos ",5,1,11,2,2019,3,4,0,0,0,52,3,290,0.0,0.7793103448275862,0,47,23,0.851063829787234,0.013793103448275862,3,0,26.023827,Ingreso a la Universidad
no me llega el correo electronico para poder continuar con el tramite de inscripsion...he creado un nuevo correo electronico para poder recibir el mensaje para poder continuar y quiero saber &iquest;cuanto es el lapso para recibir tal mensaje?...gracias por su atencion ,4,3,3,1,2016,1,7,0,0,1,54,7,270,0.0,0.8148148148148148,0,42,19,0.7142857142857143,0.02962962962962963,6,0,25.905829999999998,Ingreso a la Universidad
hola mi consulta es por la inscripcion. llene el formulario online la semana pasada y todavia no me llega el mail para poder continuar la inscripcion. quisiera poder saber si podian ayudarme. gracias ,0,4,10,2,2018,0,8,0,0,1,0,3,200,0.0,0.82,0,34,16,0.8529411764705882,0.015,3,0,25.673977,Ingreso a la Universidad
hola .&iquest; cuanto tarda en llegarte el mail de las  pre inscripción? llene los datos pero no me llego nada. muchas gracias.  ,2,1,3,1,2018,0,4,0,0,0,0,3,129,0.0,0.7674418604651163,1,25,14,0.92,0.03875968992248062,3,0,25.66434,Ingreso a la Universidad
"quería consultar mi numero de legajo. ademas al ingresar a &quot;acceso para aspirantes&quot; coloco mi numero de documento y me salta que no existen datos para el aspirante ingresado. y yo realice la inscripción en noviembre. desde ya, muchas gracias.   ",1,4,12,2,2015,3,7,0,0,1,2,7,255,0.0,0.8,2,43,21,0.8372093023255814,0.027450980392156862,4,0,25.548412,Ingreso a la Universidad
"quería consultar mi numero de legajo. ademas al ingresar a &quot;acceso para aspirantes&quot; coloco mi numero de documento y me salta que no existen datos para el aspirante ingresado. y yo realice la inscripción en noviembre. desde ya, muchas gracias.   ",1,4,12,2,2015,3,7,0,0,1,2,7,255,0.0,0.8,2,43,21,0.8372093023255814,0.027450980392156862,4,0,25.548412,Ingreso a la Universidad
"luego de realizar el primer paso por via web, &iquest;cuánto tiempo tarda en llegar el correo electrónico?. porque cuando lo realice me decía que me iba a llegar un mail pero ya espere más de 4 horas y todavía no llega ",2,3,10,2,2019,2,8,0,0,1,3,7,219,0.0,0.7853881278538812,5,42,24,0.9047619047619048,0.0182648401826484,1,0,25.412472,Ingreso a la Universidad
"hola qué tal ? yo me estaba registrando por mail ,me pidió correo electrónico para seguir la  inscripción y nunca me llegó nada al correo  ",1,4,2,1,2018,1,7,0,0,1,0,7,139,0.0,0.7913669064748201,5,28,18,0.8571428571428571,0.014388489208633094,1,0,25.391861,Ingreso a la Universidad
"hola! al hacer la inscripción web, escribí mal mi dirección de correo electrónico, por lo tanto nunca recibí el mail para proseguir con el trámite de preinscripción. &iquest;es posible volver a realizar la inscripción web de manera correcta? ",3,2,1,1,2019,3,8,0,0,1,0,7,242,0.0,0.8140495867768595,8,39,19,0.8717948717948718,0.024793388429752067,1,0,25.323338,Ingreso a la Universidad
hice la pre-nsripcion y no me llega nada a mi correo ,2,2,2,1,2018,1,1,0,0,1,5,7,53,0.0,0.7735849056603774,0,12,9,1.0,0.0,1,0,25.308994000000002,Ingreso a la Universidad
hola yo soy aspirante para 2016 ya hice la inscripción web y entrega de documentos en la unlu me dieron esta dirección http://www2.unlu.edu.ar/academica/aspirante-index.php pero dice (no existen datos del aspirante ingresado) cuales son los pasos a seguir correctamente? ,1,3,11,2,2015,1,5,0,0,1,17,3,271,0.0,0.7933579335793358,2,39,24,0.9487179487179487,0.02214022140221402,4,0,25.265415,Ingreso a la Universidad
no me llega el mail de preinscripcion para continuar con el tramite &iquest;que hago? ,0,2,4,1,2018,0,5,0,0,1,16,3,86,0.0,0.8023255813953488,0,15,9,0.9333333333333333,0.023255813953488372,1,0,25.254504999999998,Ingreso a la Universidad
estoy intentando anotarme en las materias de mi carrera pero no me llega en e-mail que la universidad deberia mandar para continuar con la preinscripcion a las cursadas ,1,1,2,1,2018,1,8,0,0,1,2,3,169,0.0,0.8284023668639053,0,29,16,0.896551724137931,0.0,1,0,25.230854,Ingreso a la Universidad
"hola, queria saber si hay alguna solucion ya que quiero realizar la inscripcion via web pero nunca me llega el mail correspondiente a mi casilla de correo electronico. espero su respuesta, desde ya, muchas gracias. ",1,3,2,1,2018,1,7,0,0,1,0,3,215,0.0,0.813953488372093,0,36,17,1.0,0.023255813953488372,2,0,25.060814,Ingreso a la Universidad
"buenas tardes, quiero continuar completando el formulario de ingreso como aspirante a la universidad y cometí el error de ingresar un mail que ya no lo tengo y es por eso que ahora el sistema me impide continuar ingresando datos con el nuevo correo electrónico. como puedo hacer?  el que ingrese en esta planilla es el correcto. gracias ",5,3,10,2,2015,2,7,0,0,1,1,7,337,0.0,0.8130563798219584,2,60,32,0.7833333333333333,0.011869436201780416,2,0,24.954159,Ingreso a la Universidad
hola! quiero hacer la inscripción a las materias como aspirante y no me llega el mail para continuar con la prescripción. como debo proceder?  gracias! ,2,4,2,1,2019,3,8,0,0,1,52,3,152,0.0,0.8026315789473685,2,27,16,0.8888888888888888,0.02631578947368421,1,0,24.892344,Ingreso a la Universidad
ya hice el primer paso de la  preinscripción pero aun no me llega al malil los pasos a seguir. ya rebice que no estuviera como spam. y el correo electronico es el correcto  ,6,3,10,2,2019,0,8,0,0,1,0,7,173,0.0,0.7861271676300579,1,36,24,0.8333333333333334,0.011560693641618497,2,0,24.852089000000003,Ingreso a la Universidad
