consulta,dia_semana,semana_del_mes,mes,cuatrimestre,anio,hora_discretizada,dni_discretizado,legajo_discretizado,posee_legajo,posee_telefono,carrera_valor,proveedor_correo,cantidad_caracteres,proporcion_mayusculas,proporcion_letras,cantidad_tildes,cantidad_palabras,cantidad_palabras_cortas,proporcion_palabras_distintas,frecuencia_signos_puntuacion,cantidad_oraciones,utiliza_codigo_asignatura,score,clase
buenas tardes. quisiera recuperar mi clave pero no me llegó al mail el recupero porque deben tener un mail que ya no uso.  el mail actual fernandocsecobomicas@hotmail.com ,2,3,12,2,2018,2,3,2,1,1,27,7,171,0.0,0.8128654970760234,1,29,17,0.8275862068965517,0.017543859649122806,3,0,32.63524,Problemas con la Clave
"buanas tardes, tengo problemas para ingresar a mi perfil, puse olvide mi clave, pero nunca me llega el mail para recuperar la conrtraseña, anteriormente me paso, pero la recupere sin inconvenientes y el mail es el mismo, nunca lo cambie, como puedo hacer? ",1,4,6,1,2016,2,2,1,1,1,54,3,256,0.0,0.80078125,0,44,23,0.7954545454545454,0.03125,1,0,32.526516,Problemas con la Clave
"buenos días, no puedo ingresar a mi perfil de esrudiante, quiero reestablecer la contraseña porque me aparece como incorrecta pero no me llega el mail, no aparece ni en la casilla de correos no deseados! gracias.  ",0,2,2,1,2019,1,6,4,1,1,5,10,214,0.0,0.8037383177570093,1,38,19,0.7894736842105263,0.02336448598130841,1,0,32.453484,Problemas con la Clave
"hola, no puedo entrar a la pagina con mi clave y estoy intentando cambiarla y nunca me llega el email para restablecerla. hace una semana que todos los dias pongo olvide mi clave y nunca puedo restablecerla. ayuda por favor. ",4,4,11,2,2017,1,5,2,1,0,3,7,225,0.0,0.8044444444444444,0,41,19,0.8292682926829268,0.017777777777777778,3,0,32.393566,Problemas con la Clave
"hola, no puedo entrar a la pagina con mi clave y estoy intentando cambiarla y nunca me llega el email para restablecerla. hace una semana que todos los dias pongo olvide mi clave y nunca puedo restablecerla. ayuda por favor. ",4,4,11,2,2017,1,5,2,1,0,3,7,225,0.0,0.8044444444444444,0,41,19,0.8292682926829268,0.017777777777777778,3,0,32.393566,Problemas con la Clave
no me llegó ningún correo me urge reestablecer mí clave por favor ya envié otro correo y no he obtenido respuesta ,2,4,2,1,2018,3,8,4,1,1,41,3,114,0.0,0.8157894736842105,4,22,12,0.8636363636363636,0.0,1,0,32.358173,Problemas con la Clave
"hola buen dia, estoy tratando de ingresar a mi cuenta desde la pagina y no puedo reestablecer mi contraseña, estoy ingresando desde otra compu y no me acuerdo la contraseña, el tema es que cuando pongo recordar clave y me pide los datos me dice que ha sido enviado a mi mail la contraseña pero a mi mail no me llega. espero alguna respuesta  saludos ",6,2,12,2,2015,2,4,2,1,0,3,7,350,0.0,0.8,0,67,40,0.7014925373134329,0.011428571428571429,1,0,32.186813,Problemas con la Clave
quiero restablecer micontraseña como estudiante y no puedo hacerlo ya que tengo otro correo electrónico el anterior ya no esta en uso. el nuevo es polysilva1982@gmail.com como hago para reestablecer la clave ,2,4,11,2,2016,1,2,1,1,1,5,3,208,0.0,0.8125,1,33,19,0.8787878787878788,0.009615384615384616,2,0,32.12444,Problemas con la Clave
"buenas tardes, quiero entrar al aula virtual pero no puedo, me dice que la contraseña esta mal, la vuelvo a escribir y me salta error. luego puse para reestablecer la contraseña y no me llega el mail. desde ya muchas gracias  ",3,1,2,1,2019,2,6,4,1,1,5,10,226,0.0,0.7920353982300885,0,43,24,0.813953488372093,0.022123893805309734,2,0,32.096188,Problemas con la Clave
"buenas tardes no puedo restablecer mi clave de ingreso ,copio y pego en el buscador pero no es posible restablecerla. como puedo ingresar una nueva ya que me olvide la anterior gracias saludos cordiales ",1,1,1,1,2017,2,1,2,1,1,5,7,203,0.0,0.8226600985221675,0,35,17,0.9428571428571428,0.009852216748768473,1,0,31.835037,Problemas con la Clave
hola buenas tardes. me comunico con ustedes porque no puedo hacer el cambio de mail para poder entrar a mi información académica. porque el mail que tengo no me llega nada. y necesito reestablecer la contraseña. ,2,1,12,2,2018,0,5,3,1,1,54,3,212,0.0,0.8113207547169812,2,37,18,0.8648648648648649,0.018867924528301886,4,0,31.800040999999997,Problemas con la Clave
"hola, buen día, quisiera restablecer mi contraseña para ingresar a la información académica, ya que la olvidé. nose como hacer para establecer una nueva. saludos y gracias.  ",1,1,7,1,2018,0,3,1,1,1,54,12,174,0.0,0.8045977011494253,4,29,16,0.896551724137931,0.034482758620689655,3,0,31.606673999999998,Problemas con la Clave
"buenos dias, el sistema me pide cambio de clave para ingresar. realmente no la recuerdo, hago los pasos indicados por mail para restablecer la clave. cuando vuelvo a ingresar pongo la clave actual que hace un rato reestableci y me dice que no es esa la clave actual . espero sus indicaciones para poder resolverlo. muchas gracias ",1,3,2,1,2018,0,1,4,1,1,5,3,330,0.0,0.8090909090909091,0,58,31,0.8103448275862069,0.01818181818181818,4,0,31.568714,Problemas con la Clave
"hola , a olvide mí clave trate de restablecerla pero no me llegan los mails. talvez cuando hice el cambio de correo lo escribí mal. cómo puedo hacer?? ",1,1,10,2,2017,2,3,2,1,1,3,3,151,0.0,0.7814569536423841,3,29,16,0.9655172413793104,0.033112582781456956,2,0,31.211212,Problemas con la Clave
hola quisiera saber si pueden restablecer mi contraseña de mi perfil de estudiante y enviarla por mi correo electrónico porqué pongo la opción que me olvide la contraseña y no me llega el  e-mail muchas gracias. ,3,4,6,1,2018,0,7,4,1,1,5,3,212,0.0,0.8160377358490566,3,38,19,0.7894736842105263,0.0047169811320754715,1,0,31.141541999999998,Problemas con la Clave
"hola que tal, tengo problemas en reestablecer mi contraseña no recibo el mail para crear una nueva. muchas gracias ",0,1,7,1,2018,0,7,3,1,1,54,3,115,0.0,0.8173913043478261,0,20,11,1.0,0.017391304347826087,1,0,31.03637,Problemas con la Clave
no puedo entrar porque no recuerdo la clave y sigo los pasos para restablecerla pero no llega nada a mi correo que es juanmillonario11@gmail.com y no creo que lo cambie.  ,0,5,4,1,2018,1,8,4,1,0,43,3,171,0.0,0.7894736842105263,0,32,21,0.8125,0.011695906432748537,2,0,30.91784,Problemas con la Clave
"buenos dias no puedo acceder al perfil estudiantil, solicito reestablecer la clave y no me llega a mi correo electronico. gracias disculpe las molestias ",0,1,2,1,2018,0,6,3,1,1,25,7,153,0.0,0.8300653594771242,0,25,11,0.96,0.013071895424836602,1,0,30.636988,Problemas con la Clave
"se me olvido la contraseña y para reestablerla creo que me manda mensaje a un mail equivocado, entonces nunca me llega el mail. el mail al que me debería llegar es walter_danirodriguez@hotmail.com.ar.  ",1,1,8,2,2018,3,3,1,1,1,3,7,202,0.0,0.801980198019802,1,34,21,0.7941176470588235,0.024752475247524754,4,0,30.53752,Problemas con la Clave
"hola, no recuerdo mi clave, intente entrar con mi dni y dice incorrecto. quise poner para reestablecer y no me llega nada al e mail. por otro lado, ya esta abierta la inscripcion a materias de licenciatura? muchas gracias  ",2,1,8,2,2018,0,4,2,1,1,15,7,223,0.0,0.7937219730941704,0,41,23,0.9024390243902439,0.026905829596412557,2,0,30.479515000000003,Problemas con la Clave
"hola no puedo cambiar mi clave debido a que las opciones de mi domicilio que me ofrecen son incorrectas yo vivo en el km 92.500 de zarate.y no aparece esta opcion aparecen km 158 y otras entonces no puedo ingresar a mi informacion academica, como puedo solucionarlo? gracias  ",3,1,4,1,2016,0,1,3,1,1,29,3,276,0.0,0.7789855072463768,0,50,28,0.78,0.014492753623188406,2,0,67.80589,Reincorporación
"buenas tardes. el motivo de mi comunicación con uatedes es dado que deseo retomar una nueva carrera en la sede de campana y para poder re incribirme de nuevo estoy como alumno libre, quisiera saber como hacer para reincribime y ser alumno regular. a la espera de su respuesta.  saludos ",4,4,9,2,2016,1,3,1,1,1,27,3,286,0.0,0.8076923076923077,1,52,27,0.8269230769230769,0.013986013986013986,3,0,21.52829,Reincorporación
hola quería saber porque figuro deje de figurar como alumno regular en la carrera siendo que hace un año solicite la reincorporación a la misma en el plan 1711.  ,0,1,3,1,2019,2,4,1,1,1,17,3,162,0.0,0.7839506172839507,2,31,18,0.8709677419354839,0.006172839506172839,1,0,21.308723,Reincorporación
"entre a acceso a estudiante y me dice que perdí la regularidad, me mandaron un mail para poder recuperarla ,segui los pasos y me dice que espere, a las horas intento volver a ingresar y me dice ud. tiene una solicitud de reincorporación pendiente, este tramite cuanto tarda? a que se debe esto? necesito anotarme en el primer cuatrimestre y no me deja ingresar, que debo hacer?     ",2,4,2,1,2018,2,5,3,1,1,3,7,382,0.0,0.7905759162303665,2,72,43,0.7222222222222222,0.02356020942408377,1,0,18.592844,Reincorporación
quisiera saber si todavia estoy como alumno regular o debo reincribirme ,3,2,3,1,2018,2,2,1,1,1,54,12,72,0.0,0.8472222222222222,0,12,5,1.0,0.0,1,0,18.4785,Reincorporación
"hola, trate de incribirme en este cuatrimestre y me figura que no estoy regular ",2,1,3,1,2017,2,2,2,1,1,58,10,80,0.0,0.8125,0,15,8,1.0,0.0125,1,0,18.216244,Reincorporación
buenas tardes! anoche intente inscribirme a materias del 1er cuatrimestre y me sorprendió conocer que no era alumna regular. solicite la regularidad y aún sigue pendiente. debo hacer algún trámite en la regional san miguel?   gracias!  ,4,4,2,1,2017,2,2,2,1,0,4,3,236,0.0,0.809322033898305,4,40,19,0.875,0.0211864406779661,2,0,18.07685,Reincorporación
reincorporación en la carrera como alumna regular ,3,1,3,1,2017,1,2,1,1,1,4,12,50,0.0,0.86,1,8,4,1.0,0.0,1,0,18.00336,Reincorporación
qiero incribirme en la carrera de profesorado de educacion ficica y donde dise que a finalisado el periodo de inscripcion y oy es el primer dia de inscripcion como ago para anotarme o sigo insistiendo? ,1,3,10,2,2019,1,3,0,0,0,43,3,202,0.0,0.8217821782178217,0,36,22,0.8333333333333334,0.0049504950495049506,1,0,17.749163,Reincorporación
"hola, el viernes me acerque a la sede lujan para completar el formulario de reincorporacion.  hoy quise inscribirme a las cursadas via web y el sistema no me deja ya que dice que no me encuentro como alumno regular.  quisiera saber como resolver esto.  gracias. ",0,4,2,1,2018,2,2,2,1,1,17,14,262,0.0,0.7977099236641222,0,49,30,0.7755102040816326,0.019083969465648856,4,0,17.653278,Reincorporación
"hola, quisiera consultar porque veo, al imprimir el analitico, que me figuran las materias que curse de administración. carrera que deje hace muchos años, para tiempo despues, incribirme en la carrera lic. trabajo social (regular). entendiendo que son carreras distintas, no puede eliminarse de mi actual legajo? gracias ",2,1,10,2,2018,1,3,1,1,1,5,3,321,0.0,0.8130841121495327,1,49,21,0.8979591836734694,0.03115264797507788,3,0,17.361263,Reincorporación
necesito inscribirme en este cuatrimestre y figuro como no regular envie la reincorporación y no me contestaron &iquest;qué debo hacer? ,1,4,2,1,2017,2,1,2,1,1,4,14,136,0.0,0.8308823529411765,2,21,11,0.9047619047619048,0.014705882352941176,1,0,17.100388,Reincorporación
tengo problemas para ingresar a mi perfil de estudiante para inscribirme a las asignaturas: al poner mis datos me figura &quot;us. tiene un solicitud de reincorporacion pendiente&quot; a pesar de tener un mail diciendo que he confirmado mi reincorporacion. &iquest;que deberia hacer? ,5,1,3,1,2019,3,7,4,1,1,54,7,284,0.0,0.8169014084507042,0,43,20,0.8372093023255814,0.02464788732394366,2,0,17.035551,Reincorporación
deje de estudiar en el año 2011 y quiero retomar la carrera quiero saber en que fecha debo inscribirme. gracias. ,0,1,11,2,2015,3,3,1,1,1,5,7,113,0.0,0.7699115044247787,0,21,12,0.9047619047619048,0.017699115044247787,2,0,16.81674,Reincorporación
quería solicitar mi condición de alumno regular para retomar la carrera  ,3,2,7,1,2018,1,2,1,1,1,5,9,73,0.0,0.8356164383561644,2,13,6,0.9230769230769231,0.0,1,0,16.704926,Reincorporación
"estimados, la consulta refiere a mi situación de regularidad ya que hoy viernes 1 de marzo intenté inscribirme a materias y no figuro como alumno regular. desearía saber mi situación y trámites necesarios para en caso regularizar. gracias  ",4,1,3,1,2019,3,1,3,1,1,55,14,240,0.0,0.8208333333333333,5,40,20,0.85,0.0125,2,0,16.477215,Reincorporación
solicite una reinscripcion dado que no figuro como regular. en caso de haber usado las reinscripciones anteriormente como debo proceder. debo acercarme o me responderán por mail. muchas gracias ,2,4,7,1,2019,2,1,1,1,1,4,7,194,0.0,0.8350515463917526,1,30,16,0.9333333333333333,0.015463917525773196,3,0,16.386333,Reincorporación
"hola me pude anotar en las materias ,pero ahora me sale  &quot;ud. tiene una solicitud de reincorporación pendiente&quot; &iquest;que puedo hacer? soy alumna regular ",1,1,3,1,2019,0,5,2,1,1,0,7,166,0.0,0.7951807228915663,1,26,12,0.9230769230769231,0.03614457831325301,1,0,16.348944,Reincorporación
"quiero incribirme en la carrera, pero me dice q yo ya estoy inscripta, que debo hacer? gracias  ",5,2,11,2,2015,2,1,0,0,1,52,7,96,0.0,0.78125,0,19,12,0.9473684210526315,0.03125,1,0,16.002261999999998,Reincorporación
"he solicitado la reincorporación como alumna regular, pero no estoy habilitada y sigue apareciendo el aviso de que debo reincorporarse cada vez que cargo legajo con clave. por favor podrían decirme a qué se debe. desde ya gracias ",4,2,5,1,2018,2,3,1,1,1,27,3,230,0.0,0.8217391304347826,3,39,20,0.9743589743589743,0.013043478260869565,2,0,15.799412,Reincorporación
solicito la reincorporación a la carrera para poder inscribirme en las materias pendientes. gracias.  ,2,2,3,1,2017,0,1,1,1,1,5,7,102,0.0,0.8333333333333334,1,16,8,0.875,0.0196078431372549,2,0,15.737929000000001,Reincorporación
"buenas noches:  quise verificar mi situación académica pero figuro como alumno no regular. desearía saber si debo reenscribirme, ya que cursé todas las materias, pero debo finales y la tesis.  &iquest;podré anotarme para rendir en mayo? muchas gracias ",0,1,3,1,2018,3,1,3,1,1,10,3,252,0.0,0.8095238095238095,5,41,18,0.9024390243902439,0.027777777777777776,2,0,15.731124,Reincorporación
"como hago pra reincorporarme dado que perdi la regularidad y quiero inscribirme a las materias, me dice que tengo una solicitud de reincorporacion pendiente.  ",2,1,3,1,2017,0,4,2,1,1,2,14,159,0.0,0.8301886792452831,0,26,16,0.9230769230769231,0.012578616352201259,1,0,15.598314000000002,Reincorporación
"estimados, buen dia. a principios del cuatrimestre solicite la extencion de regularidad por la materia metodologia de la investigacion, la cual ya fue confirmada. intento inscribirme para rendir, pero solo figura la opcion &quot;libre&quot;. podrian informarme si debo o no solicitar la inscripcion en esa condicion para rendir el final como regular, o debo aguardar? muchas gracias saludos carolina pons ",6,1,7,1,2017,2,4,2,1,0,3,7,405,0.0,0.8222222222222222,0,61,32,0.8524590163934426,0.024691358024691357,3,0,15.517069000000001,Reincorporación
"preciso solicitar la reincorporación a la carrera, y por internet me figura pendiente y no puedo acceder a la informacióm academica.  gracias ",0,4,1,1,2019,1,4,3,1,0,54,7,142,0.0,0.823943661971831,2,24,12,0.7916666666666666,0.014084507042253521,1,0,15.463510999999999,Reincorporación
qiero reinscribirme en la carrera en caso de que ya se hayan cumplido los dos años correspondientes a la regularidad.  ,6,4,1,1,2016,0,5,2,1,0,3,10,119,0.0,0.8151260504201681,0,22,15,0.8636363636363636,0.008403361344537815,1,0,15.449888,Reincorporación
"buenas tardes, el día jueves 3 de enero pedí una reincorporación a la carrera, ya que no me encuentro regular. quisiera tener respuesta del mismo ya que en la pagina me figura pendiente, todavía. muchas gracias! ",1,2,1,1,2019,2,6,3,1,1,18,7,212,0.0,0.7971698113207547,4,37,19,0.8918918918918919,0.02830188679245283,2,0,15.439809,Reincorporación
no figuro como alumno regular necesitaría inscribirme para curzar este cuatrimestre  ,4,1,3,1,2019,1,2,2,1,1,54,14,85,0.0,0.8588235294117647,1,13,6,0.9230769230769231,0.0,1,0,15.431984,Reincorporación
"no figuro como alumno regular, aunque estoy tramitando la pasantia correspondiente a la titulacion como técnico. el numero de tramite es el tri-luj:0007862/2017, por lo que entiendo deberia estar como alumno regular. gracias. ",5,3,3,1,2018,2,1,1,1,1,29,3,226,0.0,0.7699115044247787,1,34,15,0.8529411764705882,0.02654867256637168,3,0,15.333060000000001,Reincorporación
tramite una reincorporacion el dia 16/02/2017 y aun no puedo incribirme en las materias pra cursar ,2,1,3,1,2017,0,2,1,1,1,54,7,99,0.0,0.7373737373737373,0,17,10,1.0,0.0,1,0,15.303460999999999,Reincorporación
hola que tal? queria saber si para retomar la carrera el año siguiente (curse dos materias el primer cuatrimestre pero deje) debo reinscribirme nuevamente o solo anotarme en las materias que quiero cursar. gracias ,3,2,11,2,2018,0,7,4,1,1,19,3,214,0.0,0.822429906542056,0,35,18,0.9142857142857143,0.009345794392523364,1,0,15.287022,Reincorporación
deseo incribirme en lesta carrera podrian brindarme informacion y fechas de inscripcion para el año 2018. x favor. muchas gracias  ,2,2,8,2,2018,0,3,0,0,1,5,4,131,0.0,0.7938931297709924,0,22,9,0.9545454545454546,0.015267175572519083,2,0,15.251270000000002,Reincorporación
"hola buen dia, en el dia de ayer consulte la pagina en informacion academica ,y me salto un cartel donde decia que no me encontraba regular en la carrera y no es posible solicitar una reincorporacion por web porque presento ,mas de dos reincorporaciones al 31/12/15, para regularizar debo presenatrme personalmente. intente comunicarme con alumno para poder, ver esta situacion y que tiempo tengo para regularizar esta situacion, desde ya agradezco su respuesta, saludos carolina ",4,4,2,1,2017,0,2,1,1,1,27,14,480,0.0,0.8104166666666667,0,76,41,0.8421052631578947,0.016666666666666666,1,0,15.098189000000001,Reincorporación
no me llegó ningún correo y me figura alumno libre en la carrera pendiente de tramite. que significa? muchas gracias!!! ,6,1,7,1,2016,2,2,1,1,1,25,14,120,0.0,0.7916666666666666,2,21,9,0.9523809523809523,0.041666666666666664,1,0,15.040445000000002,Reincorporación
"muy buenas noches, deseo incribirme en la carrera de licenciatura en trabajo social, puedo realizar la inscripcion via web?? muchas gracias. ",1,1,2,1,2016,3,8,3,1,1,5,14,141,0.0,0.8156028368794326,0,22,8,0.9090909090909091,0.03546099290780142,1,0,15.02236,Reincorporación
"hola ,yo soy licenciada en educación inicial ,pedí simultaneidad con ciencias de la educación y no curse. ciencias de la educación.quiero retomar  para inscribirme en las materias.  qué trámite debo hacer para volver a ser alumno regular e inscribirme 2018 en materias a fines a la carrera  ",1,5,10,2,2017,0,1,1,1,1,4,7,291,0.0,0.7972508591065293,6,51,29,0.7254901960784313,0.01718213058419244,3,0,15.02115,Reincorporación
"buenas tardes! soy estudiante en condición libre. quisiera incribirme nuevamente en la carrera, &iquest;cómo debo hacer? y que documentaciodocumentación debo presentar? desde ya muchas gracias! ",6,4,10,2,2018,2,4,2,1,1,3,7,194,0.0,0.8298969072164949,3,26,10,0.9230769230769231,0.03608247422680412,1,0,14.9797125,Reincorporación
"hola intenté inscribirme en las materias a traves de la web y no me permite, me dice que no soy alumna regular. por las dudas dejo mi número de legajo 133627 . es raro, porque a mi ya me habian dado el alta. cuando me acerqué a la unlu me dijeron que mi legajo ya estaba habilitado pero acá me aparece que no soy alumna regular y no me puedo inscribir en las materias. ",1,1,3,1,2016,0,2,2,1,1,5,7,369,0.0,0.7669376693766937,4,75,48,0.6666666666666666,0.016260162601626018,4,0,14.936148000000001,Reincorporación
"buenos días...estoy intentando anotarme en las materias, pero me figura que estoy libre o no regular...mi mail es otro, por lo tanto la info que me mandan no me llega para la reinscripcion..les dejo el nuevo sebastianpecarrere@hotmail.com  ",0,4,2,1,2017,0,3,1,1,1,3,7,240,0.0,0.7916666666666666,1,39,23,0.8461538461538461,0.04583333333333333,9,0,14.910927,Reincorporación
hola ketal m llamo jeremias mi consulta es por que no puedo incribirme a la universidad en profesorado de geografia? me dice que soy un estudiante pero yo deje de ir por poblemas pero ahora kiero inscribirme en la carrera de peofesorado de geografia y no me deja? ,5,2,3,1,2017,0,7,0,0,1,0,3,264,0.0,0.8106060606060606,0,49,31,0.7959183673469388,0.007575757575757576,1,0,14.860627,Reincorporación
"hola mi consulta es la siguiente desde el dia lunes 27 estoy intentando ingresar para incribirme en las materias y me aparece un mensaje que dice que no figuro como alumna regular y que  me van enviar un mail, este aun no ha llegado e intentado nuevamente los dias 28 y 1 ya q la inscripcion finaliza el dia 2 de marzo.desde ya muchas gracias  ",2,1,3,1,2017,2,1,1,1,1,5,7,344,0.0,0.7819767441860465,0,68,44,0.8088235294117647,0.005813953488372093,1,0,14.824993,Reincorporación
no puedo incribirme porq m duce q ya soy alumno. cosa q no lo soy ,2,3,5,1,2017,0,4,0,0,1,0,7,66,0.0,0.7575757575757576,0,16,13,0.8125,0.015151515151515152,1,0,14.739113,Reincorporación
"buenas tardes, quise ingresar en el dia de la fecha para inscribirme en las materia del primer cuatrimestre y me figura que no soy un alumno regular, hice la reincorporacion el año pasado ",3,4,2,1,2017,1,3,1,1,1,27,14,188,0.0,0.8138297872340425,0,34,20,0.9117647058823529,0.010638297872340425,1,0,14.644901,Reincorporación
"buenos días, el motivo de este mail es para preguntar por que al momento de inscribirme a las materias correspondientes de este año, siendo alumno regular el año pasado, me pide la pagina web una reincorporación a la universidad y a su vez no me deja operar mediante el usuario.  quisiera saber si tengo que esperar esa solicitud o ir hacer personalmente los tramites a la universidad.  espero su respuesta, gracias.    ",4,4,2,1,2017,2,4,2,1,1,54,3,420,0.0,0.8023809523809524,2,77,47,0.7662337662337663,0.016666666666666666,3,0,14.637929999999999,Reincorporación
buenas tardes les consulto necesito inscribirme en la carrera había quedado libre pero ya solucione el tramite de reinscripcion tengo legajo nuevo - pero cuando quiero inscribirme me sale una leyenda. el estudiante no se encuentra regular en la carrera. ud. tenía un trámite pendiente y se han agotado la cantidad de reenvios de correo permitidos para continuar su trámite de reincorporación por web. por favor - ayuda!!! gracias  ,4,4,2,1,2017,1,2,4,1,1,54,3,431,0.0,0.8167053364269141,5,71,34,0.8028169014084507,0.016241299303944315,4,0,14.595528,Reincorporación
"buenas noches, hoy me acerqué personalmente a la oficina de alumnos solicitando una reincorporación,  ya que no puedo inscribirme en las materias. me dijeron que tendría que haber recibido un mail automáticamente, pero no recibí nada... que debo hacer? gracias ",0,1,8,2,2019,3,2,1,1,1,3,14,261,0.0,0.8122605363984674,5,42,22,0.8571428571428571,0.03065134099616858,4,0,14.595051999999999,Reincorporación
"buenas noches, hoy me acerqué personalmente a la oficina de alumnos solicitando una reincorporación,  ya que no puedo inscribirme en las materias. me dijeron que tendría que haber recibido un mail automáticamente, pero no recibí nada... que debo hacer? gracias ",0,1,8,2,2019,3,2,1,1,1,3,14,261,0.0,0.8122605363984674,5,42,22,0.8571428571428571,0.03065134099616858,4,0,14.595051999999999,Reincorporación
"que tal, intento anotarme en materias y me dice que no soy alumna regular, hice solicitud de reincorporacion, y me larga un cartel que tengo una solicitud pendiente, pero cuando             coloco el link me dice que es inexistente, me preocupa porq mañana  termina la inscripcion y no pude reincorporarme. desde ya muchas gracias!  ",1,1,3,1,2019,2,3,1,1,1,54,7,333,0.0,0.7777777777777778,0,68,45,0.6323529411764706,0.021021021021021023,1,0,14.486937,Reincorporación
"mi consulta es sobre mi regularidad. yo empece el año pasado me reinscribi este año no figuro como alumno regular, ",4,4,2,1,2017,3,2,1,1,0,54,3,115,0.0,0.808695652173913,0,21,12,0.9047619047619048,0.017391304347826087,1,0,14.41585,Reincorporación
"hola no pude realizar la inscripcion via web,por no poder restablecer la contraseña.me acerque el año pasado personalmente a la sede y me dijeron que era alumna regular aun. y quiero saber si mi condicion es regular o libre.desde ya muchas gracias!! ",4,4,2,1,2017,3,1,3,1,0,26,14,250,0.0,0.808,0,43,24,0.8837209302325582,0.024,3,0,14.40825,Reincorporación
"hola disculpen las molestias, quería saber por que no puedo inscribirme a las materias, cuando ya estoy cursando el taller y ademas ya validaron mis vacunas. me sale un cartel que dice &quot;ud. no cumple con los requisitos necesarios para confirmar su inscripción a cursadas.&quot; cual es el requisito que no cumplo? desde ya muchas gracias.  ",1,3,2,1,2017,3,8,0,0,1,52,3,345,0.0,0.8028985507246377,2,58,31,0.8275862068965517,0.02608695652173913,4,0,44.364998,Requisitos de Ingreso
&iquest;por qué dice &quot;ud. no cumple con los requisitos necesarios para confirmar su inscripción a cursadas&quot;? no puedo inscribirme en la cursada de materias. ,0,1,2,1,2018,3,8,0,0,0,54,7,167,0.0,0.8023952095808383,2,25,13,0.96,0.03592814371257485,2,0,41.156690000000005,Requisitos de Ingreso
"hola, perdón la molestia, al intentar inscribirme a las cursadas me salta un cartel, que dice lo siguiente: ud. no cumple con los requisitos necesarios para confirmar su inscripción a cursadas ",1,3,2,1,2019,1,8,0,0,1,54,3,193,0.0,0.8134715025906736,2,32,17,0.9375,0.025906735751295335,1,0,40.91404,Requisitos de Ingreso
